{
  "schemaVersion": "1.1",
  "packId": "ks3_rs_religion_in_modern_britain_passages",
  "subject": "religion",
  "sourceLanguageCode": "en-GB",
  "targetLanguageCode": "en-GB",
  "speechLanguage": "en-GB",
  "items": [
    {
      "id": "rmb_p01",
      "type": "passage",
      "level": "KS3 / Year 7-9",
      "topics": [
        "Religion in Modern Britain: Census and Diversity"
      ],
      "tags": [
        "KS3",
        "religious_studies",
        "religion_in_modern_britain"
      ],
      "data": {
        "title": "Religious Diversity in Modern Britain",
        "sourcePassage": "Britain today is one of the most religiously diverse societies in the world. Walk through any major city and you will find churches, mosques, synagogues, mandirs, gurdwaras, and Buddhist centres. Religious communities from around the world have made Britain their home, and this has shaped British culture, food, festivals, and public life. The 2021 census for England and Wales showed a significant change in religious identity compared to previous decades. Christianity remained the largest religion, with 46.2% of people identifying as Christian — but this was a sharp decline from 71.7% in 2001. For the first time, less than half the population identified as Christian. Over a third (37.2%) identified as having no religion. Islam was the largest non-Christian religion at 6.5%, followed by Hinduism (1.7%), Sikhism (0.9%), Judaism (0.5%), and Buddhism (0.5%). Census data must be interpreted carefully. Not everyone who identifies as Christian is a regular churchgoer — many tick 'Christian' because of background, baptism, or cultural identity. Similarly, 'no religion' does not always mean atheism; some people in this category believe in something spiritual but do not identify with an organised faith. Religious diversity is also unevenly spread: it is concentrated in urban areas such as London, Birmingham, Bradford, and Leicester. Rural Britain tends to be more homogeneously Christian or non-religious. Britain's religious landscape is complex and changing — and it requires respectful understanding from all sides.",
        "targetPassage": "Britain today is one of the most religiously diverse societies in the world. Walk through any major city and you will find churches, mosques, synagogues, mandirs, gurdwaras, and Buddhist centres. Religious communities from around the world have made Britain their home, and this has shaped British culture, food, festivals, and public life. The 2021 census for England and Wales showed a significant change in religious identity compared to previous decades. Christianity remained the largest religion, with 46.2% of people identifying as Christian — but this was a sharp decline from 71.7% in 2001. For the first time, less than half the population identified as Christian. Over a third (37.2%) identified as having no religion. Islam was the largest non-Christian religion at 6.5%, followed by Hinduism (1.7%), Sikhism (0.9%), Judaism (0.5%), and Buddhism (0.5%). Census data must be interpreted carefully. Not everyone who identifies as Christian is a regular churchgoer — many tick 'Christian' because of background, baptism, or cultural identity. Similarly, 'no religion' does not always mean atheism; some people in this category believe in something spiritual but do not identify with an organised faith. Religious diversity is also unevenly spread: it is concentrated in urban areas such as London, Birmingham, Bradford, and Leicester. Rural Britain tends to be more homogeneously Christian or non-religious. Britain's religious landscape is complex and changing — and it requires respectful understanding from all sides.",
        "questions": [
          {
            "id": "rmb_p01_q1",
            "questionType": "multiple_choice",
            "question": "What percentage of people in England and Wales identified as Christian in the 2021 census?",
            "options": [
              "71.7%",
              "37.2%",
              "46.2%",
              "6.5%"
            ],
            "correctOptionIndex": 2
          },
          {
            "id": "rmb_p01_q2",
            "questionType": "multiple_choice",
            "question": "What was the largest non-Christian religion in England and Wales according to the 2021 census?",
            "options": [
              "Hinduism",
              "Buddhism",
              "Sikhism",
              "Islam"
            ],
            "correctOptionIndex": 3
          },
          {
            "id": "rmb_p01_q3",
            "questionType": "multiple_choice",
            "question": "Why must census data about religion be interpreted carefully?",
            "options": [
              "Because the census is not an official document",
              "Because people lie about their religion on the census",
              "Because 'Christian' may mean cultural identity rather than active practice, and 'no religion' does not always mean atheism",
              "Because the census only asks about religion in urban areas"
            ],
            "correctOptionIndex": 2
          },
          {
            "id": "rmb_p01_q4",
            "questionType": "multiple_choice",
            "question": "How has the proportion identifying as Christian changed between 2001 and 2021?",
            "options": [
              "It has risen from 46.2% to 71.7%",
              "It has remained broadly the same at around 50%",
              "It has fallen sharply from 71.7% to 46.2%",
              "It has fallen to below 20% of the population"
            ],
            "correctOptionIndex": 2
          }
        ]
      }
    },
    {
      "id": "rmb_p02",
      "type": "passage",
      "level": "KS3 / Year 7-9",
      "topics": [
        "Religion in Modern Britain: Religion in Public Life"
      ],
      "tags": [
        "KS3",
        "religious_studies",
        "religion_in_modern_britain"
      ],
      "data": {
        "title": "Religion in Public Life",
        "sourcePassage": "Religion plays a significant role in British public life — though this is contested and changing. Britain has an established church: the Church of England, whose Supreme Governor is the monarch. Bishops of the Church of England sit in the House of Lords. Parliament opens with Christian prayer. Bank holidays include Good Friday and Christmas Day. The coronation ceremony is deeply rooted in Christian tradition. At the same time, the state does not enforce religious observance, and freedom of religion or belief is protected by law. Religious organisations are among Britain's most important contributors to social welfare. Food banks — many run by churches, mosques, gurdwaras, and other faith organisations — provide millions of meals each year. The Trussell Trust, the largest food bank network in Britain, has Christian roots. Sikh gurdwaras provided langar (free food) to communities during floods, COVID-19, and other emergencies. CAFOD, Islamic Relief, and Jewish Care provide domestic and international charitable services. Chaplaincy — religious and pastoral support in hospitals, schools, prisons, and the military — is provided to people of all faiths and none. Religious Education (RE) is compulsory in state schools. Its content includes both religious and non-religious worldviews, including Humanism. Faith schools (Church of England, Catholic, Jewish, Muslim, and Sikh) educate a significant proportion of British children and are sometimes controversial. Some argue that faith schools promote divisive identities; others argue they provide excellent education rooted in clear values and community.",
        "targetPassage": "Religion plays a significant role in British public life — though this is contested and changing. Britain has an established church: the Church of England, whose Supreme Governor is the monarch. Bishops of the Church of England sit in the House of Lords. Parliament opens with Christian prayer. Bank holidays include Good Friday and Christmas Day. The coronation ceremony is deeply rooted in Christian tradition. At the same time, the state does not enforce religious observance, and freedom of religion or belief is protected by law. Religious organisations are among Britain's most important contributors to social welfare. Food banks — many run by churches, mosques, gurdwaras, and other faith organisations — provide millions of meals each year. The Trussell Trust, the largest food bank network in Britain, has Christian roots. Sikh gurdwaras provided langar (free food) to communities during floods, COVID-19, and other emergencies. CAFOD, Islamic Relief, and Jewish Care provide domestic and international charitable services. Chaplaincy — religious and pastoral support in hospitals, schools, prisons, and the military — is provided to people of all faiths and none. Religious Education (RE) is compulsory in state schools. Its content includes both religious and non-religious worldviews, including Humanism. Faith schools (Church of England, Catholic, Jewish, Muslim, and Sikh) educate a significant proportion of British children and are sometimes controversial. Some argue that faith schools promote divisive identities; others argue they provide excellent education rooted in clear values and community.",
        "questions": [
          {
            "id": "rmb_p02_q1",
            "questionType": "multiple_choice",
            "question": "What does it mean for the Church of England to be the 'established church'?",
            "options": [
              "It is the oldest church building in England",
              "It is the state church, whose Supreme Governor is the monarch, with bishops in the House of Lords",
              "It is the church with the most regular weekly worshippers in Britain",
              "It is the only church legally permitted to operate in England"
            ],
            "correctOptionIndex": 1
          },
          {
            "id": "rmb_p02_q2",